{
  "schema_version": 3,
  "sprint_id": "SPRINT-32",
  "sprint_status": "Completed",
  "stories": {
    "STORY-033-02": {
      "state": "Done",
      "qa_bounces": 0,
      "arch_bounces": 0,
      "worktree": null,
      "updated_at": "2026-05-29T10:59:16.490Z",
      "notes": "",
      "lane": "standard",
      "lane_assigned_by": "migration-default",
      "lane_demoted_at": null,
      "lane_demotion_reason": null
    },
    "STORY-032-01": {
      "state": "Done",
      "qa_bounces": 0,
      "arch_bounces": 0,
      "worktree": null,
      "updated_at": "2026-05-29T11:57:40.832Z",
      "notes": "",
      "lane": "standard",
      "lane_assigned_by": "migration-default",
      "lane_demoted_at": null,
      "lane_demotion_reason": null
    },
    "STORY-033-03": {
      "state": "Done",
      "qa_bounces": 0,
      "arch_bounces": 0,
      "worktree": null,
      "updated_at": "2026-05-29T12:54:46.440Z",
      "notes": "",
      "lane": "standard",
      "lane_assigned_by": "migration-default",
      "lane_demoted_at": null,
      "lane_demotion_reason": null
    },
    "STORY-032-02": {
      "state": "Done",
      "qa_bounces": 0,
      "arch_bounces": 0,
      "worktree": null,
      "updated_at": "2026-05-29T13:41:28.024Z",
      "notes": "",
      "lane": "standard",
      "lane_assigned_by": "migration-default",
      "lane_demoted_at": null,
      "lane_demotion_reason": null
    },
    "STORY-033-04": {
      "state": "Done",
      "qa_bounces": 0,
      "arch_bounces": 0,
      "worktree": null,
      "updated_at": "2026-05-29T14:25:15.248Z",
      "notes": "",
      "lane": "standard",
      "lane_assigned_by": "migration-default",
      "lane_demoted_at": null,
      "lane_demotion_reason": null
    },
    "STORY-032-03": {
      "state": "Done",
      "qa_bounces": 1,
      "arch_bounces": 0,
      "worktree": null,
      "updated_at": "2026-05-29T15:42:04.901Z",
      "notes": "",
      "lane": "standard",
      "lane_assigned_by": "migration-default",
      "lane_demoted_at": null,
      "lane_demotion_reason": null
    }
  },
  "last_action": "close_sprint: sprint SPRINT-32 completed",
  "updated_at": "2026-05-29T18:07:15.315Z"
}
