{
  "schema_version": 3,
  "sprint_id": "SPRINT-39",
  "sprint_status": "Active",
  "stories": {
    "BUG-042": {
      "state": "Done",
      "qa_bounces": 0,
      "arch_bounces": 0,
      "worktree": null,
      "updated_at": "2026-08-27T12:28:32.188Z",
      "notes": "",
      "lane": "standard",
      "lane_assigned_by": "migration-default",
      "lane_demoted_at": null,
      "lane_demotion_reason": null
    },
    "STORY-054-05": {
      "state": "Done",
      "qa_bounces": 0,
      "arch_bounces": 0,
      "worktree": null,
      "updated_at": "2026-08-27T13:44:32.120Z",
      "notes": "",
      "lane": "standard",
      "lane_assigned_by": "migration-default",
      "lane_demoted_at": null,
      "lane_demotion_reason": null
    },
    "STORY-054-01": {
      "state": "Done",
      "qa_bounces": 0,
      "arch_bounces": 0,
      "worktree": null,
      "updated_at": "2026-08-27T14:50:32.403Z",
      "notes": "",
      "lane": "standard",
      "lane_assigned_by": "migration-default",
      "lane_demoted_at": null,
      "lane_demotion_reason": null
    },
    "STORY-054-02": {
      "state": "Done",
      "qa_bounces": 0,
      "arch_bounces": 0,
      "worktree": null,
      "updated_at": "2026-08-27T17:55:32.386Z",
      "notes": "",
      "lane": "standard",
      "lane_assigned_by": "migration-default",
      "lane_demoted_at": null,
      "lane_demotion_reason": null
    },
    "STORY-054-03": {
      "state": "Done",
      "qa_bounces": 0,
      "arch_bounces": 0,
      "worktree": null,
      "updated_at": "2026-08-27T18:56:12.651Z",
      "notes": "",
      "lane": "standard",
      "lane_assigned_by": "migration-default",
      "lane_demoted_at": null,
      "lane_demotion_reason": null
    },
    "STORY-054-04": {
      "state": "Done",
      "qa_bounces": 0,
      "arch_bounces": 0,
      "worktree": null,
      "updated_at": "2026-08-27T15:52:03.597Z",
      "notes": "",
      "lane": "standard",
      "lane_assigned_by": "migration-default",
      "lane_demoted_at": null,
      "lane_demotion_reason": null
    },
    "STORY-054-06": {
      "state": "Done",
      "qa_bounces": 0,
      "arch_bounces": 0,
      "worktree": null,
      "updated_at": "2026-08-28T09:06:11.979Z",
      "notes": "",
      "lane": "standard",
      "lane_assigned_by": "migration-default",
      "lane_demoted_at": null,
      "lane_demotion_reason": null
    },
    "STORY-054-07": {
      "state": "Done",
      "qa_bounces": 0,
      "arch_bounces": 0,
      "worktree": null,
      "updated_at": "2026-08-28T10:19:30.627Z",
      "notes": "",
      "lane": "standard",
      "lane_assigned_by": "migration-default",
      "lane_demoted_at": null,
      "lane_demotion_reason": null
    },
    "BUG-043": {
      "state": "Done",
      "qa_bounces": 0,
      "arch_bounces": 0,
      "worktree": null,
      "updated_at": "2026-08-28T18:53:42.293Z",
      "notes": "",
      "lane": "standard",
      "lane_assigned_by": "migration-default",
      "lane_demoted_at": null,
      "lane_demotion_reason": null
    },
    "CR-105": {
      "state": "Done",
      "qa_bounces": 0,
      "arch_bounces": 0,
      "worktree": null,
      "updated_at": "2026-08-28T21:51:32.426Z",
      "notes": "",
      "lane": "standard",
      "lane_assigned_by": "migration-default",
      "lane_demoted_at": null,
      "lane_demotion_reason": null
    },
    "BUG-044": {
      "state": "Done",
      "qa_bounces": 0,
      "arch_bounces": 0,
      "worktree": null,
      "updated_at": "2026-08-29T10:40:37.834Z",
      "notes": "",
      "lane": "standard",
      "lane_assigned_by": "migration-default",
      "lane_demoted_at": null,
      "lane_demotion_reason": null
    },
    "CR-106": {
      "state": "Bouncing",
      "qa_bounces": 0,
      "arch_bounces": 1,
      "worktree": null,
      "updated_at": "2026-08-29T13:24:30.319Z",
      "notes": "",
      "lane": "standard",
      "lane_assigned_by": "migration-default",
      "lane_demoted_at": null,
      "lane_demotion_reason": null
    },
    "CR-107": {
      "state": "Done",
      "qa_bounces": 0,
      "arch_bounces": 0,
      "worktree": null,
      "updated_at": "2026-08-29T13:30:03.050Z",
      "notes": "",
      "lane": "standard",
      "lane_assigned_by": "migration-default",
      "lane_demoted_at": null,
      "lane_demotion_reason": null
    },
    "BUG-045": {
      "state": "Done",
      "qa_bounces": 0,
      "arch_bounces": 0,
      "worktree": null,
      "updated_at": "2026-08-29T11:07:53.022Z",
      "notes": "",
      "lane": "standard",
      "lane_assigned_by": "migration-default",
      "lane_demoted_at": null,
      "lane_demotion_reason": null
    },
    "BUG-046": {
      "state": "Done",
      "qa_bounces": 0,
      "arch_bounces": 0,
      "worktree": null,
      "updated_at": "2026-08-29T10:34:20.979Z",
      "notes": "",
      "lane": "standard",
      "lane_assigned_by": "migration-default",
      "lane_demoted_at": null,
      "lane_demotion_reason": null
    },
    "CR-108": {
      "state": "Ready to Bounce",
      "qa_bounces": 0,
      "arch_bounces": 0,
      "worktree": null,
      "updated_at": "2026-08-27T07:45:25.442Z",
      "notes": "",
      "lane": "standard",
      "lane_assigned_by": "migration-default",
      "lane_demoted_at": null,
      "lane_demotion_reason": null
    },
    "CR-110": {
      "state": "Ready to Bounce",
      "qa_bounces": 0,
      "arch_bounces": 0,
      "worktree": null,
      "updated_at": "2026-08-27T07:45:25.442Z",
      "notes": "",
      "lane": "standard",
      "lane_assigned_by": "migration-default",
      "lane_demoted_at": null,
      "lane_demotion_reason": null
    },
    "CR-111": {
      "state": "Ready to Bounce",
      "qa_bounces": 0,
      "arch_bounces": 0,
      "worktree": null,
      "updated_at": "2026-08-27T07:45:25.442Z",
      "notes": "",
      "lane": "standard",
      "lane_assigned_by": "migration-default",
      "lane_demoted_at": null,
      "lane_demotion_reason": null
    }
  },
  "last_action": "transition CR-107 → Done",
  "updated_at": "2026-08-29T13:30:03.050Z"
}
